{
  "schemaVersion": 2,
  "ledgerId": "mesh-production-readiness",
  "sourceCommit": "ec83c942483f8d1645689bdf076a77dce27752ff",
  "sourceTreeHash": "44c9c7177535961b31277ad108b904549262f90d",
  "updatedAt": "2026-08-09T12:55:48Z",
  "gates": [
    {
      "id": "r0.frontend-tests",
      "milestone": "R0",
      "required": true,
      "releaseStatus": "local-pass",
      "status": "blocked",
      "evidence": {
        "testedCommit": null,
        "testedTreeHash": null,
        "command": null,
        "artifactPath": null,
        "environment": null,
        "collectedAt": null,
        "expiresAt": null
      },
      "owner": "Mesh client",
      "capability": "Run the frontend test suite",
      "blockReason": "Protected PR CI passed, but release evidence must come from an immutable successful push run on main. The PR artifact is bound to GitHub's synthetic merge SHA and cannot prove this branch source under the protected evidence contract.",
      "nextAction": "After an owner-reviewed merge to main, run protected CI on the exact main SHA and ingest the immutable evidence manifest.",
      "waiver": null
    },
    {
      "id": "r0.frontend-build",
      "milestone": "R0",
      "required": true,
      "releaseStatus": "local-pass",
      "status": "blocked",
      "evidence": {
        "testedCommit": null,
        "testedTreeHash": null,
        "command": null,
        "artifactPath": null,
        "environment": null,
        "collectedAt": null,
        "expiresAt": null
      },
      "owner": "Mesh client",
      "capability": "Produce the Matrix frontend bundle",
      "blockReason": "Protected PR CI passed the frontend build and bundle checks, but release evidence must come from an immutable successful push run on main. The PR artifact is not admissible release evidence for this branch source.",
      "nextAction": "After an owner-reviewed merge to main, run the Matrix production build and bundle policy in protected CI on the exact main SHA and ingest its manifest.",
      "waiver": null
    },
    {
      "id": "r0.rust-matrix",
      "milestone": "R0",
      "required": true,
      "releaseStatus": "local-pass",
      "status": "blocked",
      "evidence": {
        "testedCommit": null,
        "testedTreeHash": null,
        "command": null,
        "artifactPath": null,
        "environment": null,
        "collectedAt": null,
        "expiresAt": null
      },
      "owner": "Mesh backend",
      "capability": "Run the Matrix Rust backend tests",
      "blockReason": "Protected PR CI passed the Matrix Rust suite on Windows and Ubuntu, but release evidence must come from an immutable successful push run on main. The PR artifact is not admissible release evidence for this branch source.",
      "nextAction": "After an owner-reviewed merge to main, run the serialized Matrix Rust suite in protected Windows and Ubuntu CI on the exact main SHA and ingest its manifest.",
      "waiver": null
    },
    {
      "id": "r0.rust-legacy",
      "milestone": "R0",
      "required": true,
      "releaseStatus": "local-pass",
      "status": "blocked",
      "evidence": {
        "testedCommit": null,
        "testedTreeHash": null,
        "command": null,
        "artifactPath": null,
        "environment": null,
        "collectedAt": null,
        "expiresAt": null
      },
      "owner": "Mesh backend",
      "capability": "Keep the separately compiled legacy backend healthy",
      "blockReason": "Protected PR CI passed the separately compiled legacy backend, but release evidence must come from an immutable successful push run on main. The PR artifact is not admissible release evidence for this branch source.",
      "nextAction": "After an owner-reviewed merge to main, rerun the serialized legacy suite in protected CI on the exact main SHA without changing the Matrix shipping boundary.",
      "waiver": null
    },
    {
      "id": "r0.browser-e2e",
      "milestone": "R0",
      "required": true,
      "releaseStatus": "local-pass",
      "status": "blocked",
      "evidence": {
        "testedCommit": null,
        "testedTreeHash": null,
        "command": null,
        "artifactPath": null,
        "environment": null,
        "collectedAt": null,
        "expiresAt": null
      },
      "owner": "Mesh client",
      "capability": "Verify browser onboarding and messaging journeys",
      "blockReason": "Protected PR CI passed the pinned browser suite, but release evidence must come from an immutable successful push run on main. The PR artifact is not admissible release evidence for this branch source.",
      "nextAction": "After an owner-reviewed merge to main, run the full pinned Playwright suite in protected CI on the exact main SHA and ingest its immutable manifest.",
      "waiver": null
    },
    {
      "id": "r0.ipc-contract",
      "milestone": "R0",
      "required": true,
      "releaseStatus": "local-pass",
      "status": "blocked",
      "evidence": {
        "testedCommit": null,
        "testedTreeHash": null,
        "command": null,
        "artifactPath": null,
        "environment": null,
        "collectedAt": null,
        "expiresAt": null
      },
      "owner": "Mesh client/backend boundary",
      "capability": "Keep typed Tauri commands aligned",
      "blockReason": "Protected PR CI passed the IPC inventory and generated-type checks, but release evidence must come from an immutable successful push run on main. The PR artifact is not admissible release evidence for this branch source.",
      "nextAction": "After an owner-reviewed merge to main, run both IPC contract checks in protected CI on the exact main SHA and ingest their manifest.",
      "waiver": null
    },
    {
      "id": "r0.security-invariants",
      "milestone": "R0",
      "required": true,
      "releaseStatus": "local-pass",
      "status": "blocked",
      "evidence": {
        "testedCommit": null,
        "testedTreeHash": null,
        "command": null,
        "artifactPath": null,
        "environment": null,
        "collectedAt": null,
        "expiresAt": null
      },
      "owner": "Mesh security",
      "capability": "Enforce Matrix and legacy security boundaries",
      "blockReason": "Protected PR CI passed the Matrix and legacy security-invariant checks, but release evidence must come from an immutable successful push run on main. The PR artifact is not admissible release evidence for this branch source.",
      "nextAction": "After an owner-reviewed merge to main, run both serialized security-invariant feature sets in protected CI on the exact main SHA and ingest their manifest.",
      "waiver": null
    },
    {
      "id": "r0.public-surfaces",
      "milestone": "R0",
      "required": true,
      "releaseStatus": "local-pass",
      "status": "blocked",
      "evidence": {
        "testedCommit": null,
        "testedTreeHash": null,
        "command": null,
        "artifactPath": null,
        "environment": null,
        "collectedAt": null,
        "expiresAt": null
      },
      "owner": "Mesh release",
      "capability": "Keep reviewed services and public documentation internally consistent",
      "blockReason": "Protected PR CI passed the public-surface checks, but release evidence must come from an immutable successful push run on main. The PR artifact is not admissible release evidence for this branch source.",
      "nextAction": "After an owner-reviewed merge to main, validate public services and the static site in protected CI on the exact main SHA without deploying either surface, then ingest the manifest.",
      "waiver": null
    },
    {
      "id": "r0.dependency-advisory-policy",
      "milestone": "R0",
      "required": true,
      "releaseStatus": "local-pass",
      "status": "blocked",
      "evidence": {
        "testedCommit": null,
        "testedTreeHash": null,
        "command": null,
        "artifactPath": null,
        "environment": null,
        "collectedAt": null,
        "expiresAt": null
      },
      "owner": "Mesh dependency security",
      "capability": "Bind the exact Matrix shipping graph, reviewed warnings, legacy exclusions, and raw Rust advisory state to one policy",
      "blockReason": "Caddy is remediated and derived accountability scope keeps upstream Synapse findings visible without treating a reference deployment as a shipped client dependency. Protected Security now remains blocked because the live lk-jwt-service release tag moved away from its reviewed digest, and protected main-push provenance is still required.",
      "nextAction": "Publish a new unused lk-jwt-service tag through the reviewed manual workflow, rotate every digest-bound reference atomically, obtain an owner-reviewed merge, run protected Security on the exact main SHA, and ingest its immutable manifest while retaining Matrix-only artifact exclusion.",
      "waiver": null
    },
    {
      "id": "r1.admission-openid-verifier",
      "milestone": "R1",
      "required": false,
      "releaseStatus": "live-pass",
      "status": "blocked",
      "evidence": {
        "testedCommit": null,
        "testedTreeHash": null,
        "command": null,
        "artifactPath": null,
        "environment": null,
        "collectedAt": null,
        "expiresAt": "2026-08-29T23:59:59Z"
      },
      "owner": "Mesh identity and admission security",
      "capability": "Verify short-lived Matrix identity proofs without putting credentials in URLs",
      "blockReason": "This optional admission extension is disabled and is not a beta release requirement. The standardized Matrix OpenID userinfo flow places its assertion in a URL query, so Mesh fails closed until a reviewed POST-capable verifier can validate the issuing service, user, audience, purpose, subject, expiry, and replay state.",